category,name,description,address,price_range,rating,kids,distance_km,notes
restaurant,The Mediterra Green,Европейская морепродукты вид на бухту,Набережная,2000-3000,4.8,true,1.2,Ужин романтика детское меню
restaurant,Ла Ваш,Армянская авторская уютная атмосфера,Центр,1500-2500,4.9,true,0.8,Рейтинг 4.9 праздники
restaurant,Хачапури,Грузинская хинкали хачапури терраса,Набережная,800-1500,4.6,true,1.0,Живая музыка обед ужин
restaurant,KinZa,Грузинская кавказская рыбалка на форель,Революционная 22А,1000-2000,4.7,true,1.5,Можно ловить рыбу
restaurant,Риф,Морепродукты живая музыка два зала,Приморский б 15,1200-3500,4.9,true,1.3,Вид на море
restaurant,Шашлык-машлык,Кавказская лучший кебаб бюджетно,Ленина 16,400-600,5.0,true,0.5,3536 отзывов рейтинг 5.0
restaurant,Пицца Мия,Итальянская тонкое тесто,Крымская 3 к2,600-1200,4.5,true,0.7,Семьи с детьми
restaurant,Столовая ВиВа,Русская домашняя без пафоса,Центр,300-500,4.3,false,0.6,Бюджет домашняя еда
